<?xml version="1.0" encoding="UTF-8" ?>
<XMLDB PATH="grade/grading/form/guide/db" VERSION="20120404" COMMENT="XMLDB file for Moodle marking guide"
       xmlns:xsi="http://www.w3.org/2001/XMLSchema-instance"
       xsi:noNamespaceSchemaLocation="../../../../../lib/xmldb/xmldb.xsd"
        >
    <TABLES>
        <TABLE NAME="gradingform_guide_criteria" COMMENT="Stores the rows of the criteria grid.">
            <FIELDS>
                <FIELD NAME="id" TYPE="int" LENGTH="10" NOTNULL="true" SEQUENCE="true"/>
                <FIELD NAME="definitionid" TYPE="int" LENGTH="10" NOTNULL="true" SEQUENCE="false" COMMENT="The ID of the form definition this criterion is part of"/>
                <FIELD NAME="sortorder" TYPE="int" LENGTH="10" NOTNULL="true" SEQUENCE="false" COMMENT="Defines the order of the criterion in the guide"/>
                <FIELD NAME="shortname" TYPE="char" LENGTH="255" NOTNULL="true" SEQUENCE="false" COMMENT="shortname of this criterion"/>
                <FIELD NAME="description" TYPE="text" NOTNULL="false" SEQUENCE="false" COMMENT="The criterion description for students"/>
                <FIELD NAME="descriptionformat" TYPE="int" LENGTH="2" NOTNULL="false" SEQUENCE="false" COMMENT="The format of the description field"/>
                <FIELD NAME="descriptionmarkers" TYPE="text" NOTNULL="false" SEQUENCE="false" COMMENT="Description for Markers"/>
                <FIELD NAME="descriptionmarkersformat" TYPE="int" LENGTH="2" NOTNULL="false" SEQUENCE="false"/>
                <FIELD NAME="maxscore" TYPE="number" LENGTH="10" NOTNULL="true" SEQUENCE="false" DECIMALS="5" COMMENT="maximum grade that can be assigned using this criterion"/>
            </FIELDS>
            <KEYS>
                <KEY NAME="primary" TYPE="primary" FIELDS="id"/>
                <KEY NAME="fk_definitionid" TYPE="foreign" FIELDS="definitionid" REFTABLE="grading_definitions" REFFIELDS="id"/>
            </KEYS>
        </TABLE>
        <TABLE NAME="gradingform_guide_fillings" COMMENT="Stores the data of how the guide is filled by a particular rater">
            <FIELDS>
                <FIELD NAME="id" TYPE="int" LENGTH="10" NOTNULL="true" SEQUENCE="true"/>
                <FIELD NAME="instanceid" TYPE="int" LENGTH="10" NOTNULL="true" SEQUENCE="false" COMMENT="The ID of the grading form instance"/>
                <FIELD NAME="criterionid" TYPE="int" LENGTH="10" NOTNULL="true" SEQUENCE="false" COMMENT="The ID of the criterion (row) in the guide"/>
                <FIELD NAME="remark" TYPE="text" NOTNULL="false" SEQUENCE="false" COMMENT="Side note feedback regarding this particular criterion"/>
                <FIELD NAME="remarkformat" TYPE="int" LENGTH="2" NOTNULL="false" SEQUENCE="false" COMMENT="The format of the remark field"/>
                <FIELD NAME="score" TYPE="number" LENGTH="10" NOTNULL="true" SEQUENCE="false" DECIMALS="5" COMMENT="The score assigned"/>
            </FIELDS>
            <KEYS>
                <KEY NAME="primary" TYPE="primary" FIELDS="id"/>
                <KEY NAME="fk_instanceid" TYPE="foreign" FIELDS="instanceid" REFTABLE="grading_instances" REFFIELDS="id"/>
                <KEY NAME="fk_criterionid" TYPE="foreign" FIELDS="criterionid" REFTABLE="gradingform_guide_criteria" REFFIELDS="id"/>
                <KEY NAME="uq_instance_criterion" TYPE="unique" FIELDS="instanceid, criterionid"/>
            </KEYS>
        </TABLE>
        <TABLE NAME="gradingform_guide_comments" COMMENT="frequently used comments used in marking guide">
            <FIELDS>
                <FIELD NAME="id" TYPE="int" LENGTH="10" NOTNULL="true" SEQUENCE="true"/>
                <FIELD NAME="definitionid" TYPE="int" LENGTH="10" NOTNULL="true" SEQUENCE="false" COMMENT="The ID of the form definition this faq is part of"/>
                <FIELD NAME="sortorder" TYPE="int" LENGTH="10" NOTNULL="true" SEQUENCE="false" COMMENT="Defines the order of the comments"/>
                <FIELD NAME="description" TYPE="text" NOTNULL="false" SEQUENCE="false" COMMENT="The comment description"/>
                <FIELD NAME="descriptionformat" TYPE="int" LENGTH="2" NOTNULL="false" SEQUENCE="false" COMMENT="The format of the description field"/>
            </FIELDS>
            <KEYS>
                <KEY NAME="primary" TYPE="primary" FIELDS="id"/>
                <KEY NAME="fk_definitionid" TYPE="foreign" FIELDS="definitionid" REFTABLE="grading_definitions" REFFIELDS="id"/>
            </KEYS>
        </TABLE>
    </TABLES>
</XMLDB>
