<?xml version="1.0" encoding="UTF-8" ?>
<XMLDB PATH="question/type/essay/db" VERSION="20140113" COMMENT="XMLDB file for Moodle question/type/essay"
    xmlns:xsi="http://www.w3.org/2001/XMLSchema-instance"
    xsi:noNamespaceSchemaLocation="../../../../lib/xmldb/xmldb.xsd"
>
  <TABLES>
    <TABLE NAME="qtype_essay_options" COMMENT="Extra options for essay questions.">
      <FIELDS>
        <FIELD NAME="id" TYPE="int" LENGTH="10" NOTNULL="true" SEQUENCE="true"/>
        <FIELD NAME="questionid" TYPE="int" LENGTH="10" NOTNULL="true" SEQUENCE="false" COMMENT="Foreign key linking to the question table."/>
        <FIELD NAME="responseformat" TYPE="char" LENGTH="16" NOTNULL="true" DEFAULT="editor" SEQUENCE="false" COMMENT="The type of input area students should be given for their response."/>
        <FIELD NAME="responserequired" TYPE="int" LENGTH="2" NOTNULL="true" DEFAULT="1" SEQUENCE="false" COMMENT="Nonzero if an online text response is optional"/>
        <FIELD NAME="responsefieldlines" TYPE="int" LENGTH="4" NOTNULL="true" DEFAULT="15" SEQUENCE="false" COMMENT="Approximate height, in lines, of the input box the students should be given for their response."/>
        <FIELD NAME="attachments" TYPE="int" LENGTH="4" NOTNULL="true" DEFAULT="0" SEQUENCE="false" COMMENT="Whether, and how many, attachments a student is allowed to include with their response. -1 means unlimited."/>
        <FIELD NAME="attachmentsrequired" TYPE="int" LENGTH="4" NOTNULL="true" DEFAULT="0" SEQUENCE="false" COMMENT="The number of attachments that should be required"/>
        <FIELD NAME="graderinfo" TYPE="text" NOTNULL="false" SEQUENCE="false" COMMENT="Information shown to people with permission to manually grade the question, when they are grading."/>
        <FIELD NAME="graderinfoformat" TYPE="int" LENGTH="4" NOTNULL="true" DEFAULT="0" SEQUENCE="false" COMMENT="The text format for graderinfo."/>
        <FIELD NAME="responsetemplate" TYPE="text" NOTNULL="false" SEQUENCE="false" COMMENT="The template to pre-populate student's response field during attempt."/>
        <FIELD NAME="responsetemplateformat" TYPE="int" LENGTH="4" NOTNULL="true" DEFAULT="0" SEQUENCE="false" COMMENT="The text format for responsetemplate."/>
      </FIELDS>
      <KEYS>
        <KEY NAME="primary" TYPE="primary" FIELDS="id"/>
        <KEY NAME="questionid" TYPE="foreign-unique" FIELDS="questionid" REFTABLE="question" REFFIELDS="id"/>
      </KEYS>
    </TABLE>
  </TABLES>
</XMLDB>
