<?xml version="1.0" encoding="UTF-8" ?>
<XMLDB PATH="question/type/truefalse/db" VERSION="20120122" COMMENT="XMLDB file for Moodle question/type/truefalse"
    xmlns:xsi="http://www.w3.org/2001/XMLSchema-instance"
    xsi:noNamespaceSchemaLocation="../../../../lib/xmldb/xmldb.xsd"
>
  <TABLES>
    <TABLE NAME="question_truefalse" COMMENT="Options for True-False questions">
      <FIELDS>
        <FIELD NAME="id" TYPE="int" LENGTH="10" NOTNULL="true" SEQUENCE="true"/>
        <FIELD NAME="question" TYPE="int" LENGTH="10" NOTNULL="true" DEFAULT="0" SEQUENCE="false" COMMENT="Foreign key references question.id."/>
        <FIELD NAME="trueanswer" TYPE="int" LENGTH="10" NOTNULL="true" DEFAULT="0" SEQUENCE="false" COMMENT="Foreign key references question_answers.id. The 'True' choice."/>
        <FIELD NAME="falseanswer" TYPE="int" LENGTH="10" NOTNULL="true" DEFAULT="0" SEQUENCE="false" COMMENT="Foreign key references question_answers.id. The 'False' choice."/>
      </FIELDS>
      <KEYS>
        <KEY NAME="primary" TYPE="primary" FIELDS="id"/>
        <KEY NAME="question" TYPE="foreign" FIELDS="question" REFTABLE="question" REFFIELDS="id"/>
      </KEYS>
    </TABLE>
  </TABLES>
</XMLDB>
