<?xml version="1.0" encoding="UTF-8" ?>
<XMLDB PATH="auth/iomadoidc/db" VERSION="20260505" COMMENT="XMLDB file for Moodle auth/iomadoidc plugin"
    xmlns:xsi="http://www.w3.org/2001/XMLSchema-instance"
    xsi:noNamespaceSchemaLocation="../../../lib/xmldb/xmldb.xsd"
>
  <TABLES>
    <TABLE NAME="auth_iomadoidc_prevlogin" COMMENT="Stores previous login methods.">
      <FIELDS>
        <FIELD NAME="id" TYPE="int" LENGTH="10" NOTNULL="true" SEQUENCE="true"/>
        <FIELD NAME="userid" TYPE="int" LENGTH="10" NOTNULL="true" SEQUENCE="false" COMMENT="user id"/>
        <FIELD NAME="method" TYPE="char" LENGTH="255" NOTNULL="true" SEQUENCE="false" COMMENT="prev method"/>
        <FIELD NAME="password" TYPE="char" LENGTH="255" NOTNULL="true" SEQUENCE="false" COMMENT="prev pw"/>
      </FIELDS>
      <KEYS>
        <KEY NAME="primary" TYPE="primary" FIELDS="id"/>
      </KEYS>
      <INDEXES>
        <INDEX NAME="userid" UNIQUE="true" FIELDS="userid"/>
      </INDEXES>
    </TABLE>
    <TABLE NAME="auth_iomadoidc_state" COMMENT="Map of state to sesskey.">
      <FIELDS>
        <FIELD NAME="id" TYPE="int" LENGTH="10" NOTNULL="true" SEQUENCE="true"/>
        <FIELD NAME="sesskey" TYPE="char" LENGTH="10" NOTNULL="true" SEQUENCE="false" COMMENT="user sesskey"/>
        <FIELD NAME="state" TYPE="char" LENGTH="15" NOTNULL="true" SEQUENCE="false" COMMENT="random state"/>
        <FIELD NAME="nonce" TYPE="char" LENGTH="15" NOTNULL="true" SEQUENCE="false" COMMENT="nonce"/>
        <FIELD NAME="timecreated" TYPE="int" LENGTH="10" NOTNULL="true" SEQUENCE="false" COMMENT="time login initiated"/>
        <FIELD NAME="additionaldata" TYPE="text" NOTNULL="false" SEQUENCE="false" COMMENT="additional stored parameters"/>
      </FIELDS>
      <KEYS>
        <KEY NAME="primary" TYPE="primary" FIELDS="id"/>
      </KEYS>
      <INDEXES>
        <INDEX NAME="state" UNIQUE="false" FIELDS="state"/>
        <INDEX NAME="timecreated" UNIQUE="false" FIELDS="timecreated"/>
      </INDEXES>
    </TABLE>
    <TABLE NAME="auth_iomadoidc_token" COMMENT="Stores tokens.">
      <FIELDS>
        <FIELD NAME="id" TYPE="int" LENGTH="10" NOTNULL="true" SEQUENCE="true"/>
        <FIELD NAME="iomadoidcuniqid" TYPE="char" LENGTH="255" NOTNULL="true" SEQUENCE="false" COMMENT="iomadoidc uniqid"/>
        <FIELD NAME="username" TYPE="char" LENGTH="100" NOTNULL="true" SEQUENCE="false" COMMENT="username"/>
        <FIELD NAME="userid" TYPE="int" LENGTH="10" NOTNULL="true" DEFAULT="0" SEQUENCE="false" COMMENT="moodle userid"/>
        <FIELD NAME="iomadoidcusername" TYPE="char" LENGTH="255" NOTNULL="true" SEQUENCE="false" COMMENT="iomadoidc username"/>
        <FIELD NAME="useridentifier" TYPE="char" LENGTH="255" NOTNULL="false" SEQUENCE="false"/>
        <FIELD NAME="scope" TYPE="text" NOTNULL="true" SEQUENCE="false" COMMENT="token scope"/>
        <FIELD NAME="tokenresource" TYPE="char" LENGTH="127" NOTNULL="true" SEQUENCE="false" COMMENT="token resource"/>
        <FIELD NAME="authcode" TYPE="text" NOTNULL="true" SEQUENCE="false" COMMENT="auth code"/>
        <FIELD NAME="token" TYPE="text" NOTNULL="true" SEQUENCE="false" COMMENT="token"/>
        <FIELD NAME="expiry" TYPE="int" LENGTH="10" NOTNULL="true" SEQUENCE="false" COMMENT="token expiry"/>
        <FIELD NAME="refreshtoken" TYPE="text" NOTNULL="true" SEQUENCE="false" COMMENT="refresh token"/>
        <FIELD NAME="idtoken" TYPE="text" NOTNULL="true" SEQUENCE="false" COMMENT="id token"/>
      </FIELDS>
      <KEYS>
        <KEY NAME="primary" TYPE="primary" FIELDS="id"/>
      </KEYS>
      <INDEXES>
        <INDEX NAME="iomadoidcuniqid" UNIQUE="false" FIELDS="iomadoidcuniqid"/>
        <INDEX NAME="userid" UNIQUE="false" FIELDS="userid"/>
        <INDEX NAME="username" UNIQUE="false" FIELDS="username"/>
        <INDEX NAME="iomadoidcusername" UNIQUE="false" FIELDS="iomadoidcusername"/>
      </INDEXES>
    </TABLE>
    <TABLE NAME="auth_iomadoidc_sid" COMMENT="Stores sid from IdP, to be used to find connected Moodle users when SLO is triggered from IdP.">
      <FIELDS>
        <FIELD NAME="id" TYPE="int" LENGTH="10" NOTNULL="true" SEQUENCE="true"/>
        <FIELD NAME="userid" TYPE="int" LENGTH="20" NOTNULL="true" SEQUENCE="false"/>
        <FIELD NAME="sid" TYPE="char" LENGTH="36" NOTNULL="true" SEQUENCE="false"/>
        <FIELD NAME="timecreated" TYPE="int" LENGTH="10" NOTNULL="true" SEQUENCE="false"/>
      </FIELDS>
      <KEYS>
        <KEY NAME="primary" TYPE="primary" FIELDS="id"/>
      </KEYS>
    </TABLE>
  </TABLES>
</XMLDB>
