<?xml version="1.0" encoding="UTF-8" ?>
<XMLDB PATH="search/engine/simpledb/db" VERSION="20160408" COMMENT="XMLDB file for Moodle search/engine/simpledb"
    xmlns:xsi="http://www.w3.org/2001/XMLSchema-instance"
    xsi:noNamespaceSchemaLocation="../../../../lib/xmldb/xmldb.xsd"
>
  <TABLES>
    <TABLE NAME="search_simpledb_index" COMMENT="search_simpledb table containing the index data.">
      <FIELDS>
        <FIELD NAME="id" TYPE="int" LENGTH="10" NOTNULL="true" SEQUENCE="true"/>
        <FIELD NAME="docid" TYPE="char" LENGTH="255" NOTNULL="true" SEQUENCE="false"/>
        <FIELD NAME="itemid" TYPE="int" LENGTH="10" NOTNULL="true" SEQUENCE="false"/>
        <FIELD NAME="title" TYPE="text" NOTNULL="false" SEQUENCE="false"/>
        <FIELD NAME="content" TYPE="text" NOTNULL="false" SEQUENCE="false"/>
        <FIELD NAME="contextid" TYPE="int" LENGTH="10" NOTNULL="true" SEQUENCE="false"/>
        <FIELD NAME="areaid" TYPE="char" LENGTH="255" NOTNULL="true" SEQUENCE="false"/>
        <FIELD NAME="type" TYPE="int" LENGTH="1" NOTNULL="true" SEQUENCE="false"/>
        <FIELD NAME="courseid" TYPE="int" LENGTH="10" NOTNULL="true" SEQUENCE="false"/>
        <FIELD NAME="owneruserid" TYPE="int" LENGTH="10" NOTNULL="false" SEQUENCE="false"/>
        <FIELD NAME="modified" TYPE="int" LENGTH="10" NOTNULL="true" SEQUENCE="false"/>
        <FIELD NAME="userid" TYPE="int" LENGTH="10" NOTNULL="false" SEQUENCE="false"/>
        <FIELD NAME="description1" TYPE="text" NOTNULL="false" SEQUENCE="false"/>
        <FIELD NAME="description2" TYPE="text" NOTNULL="false" SEQUENCE="false"/>
      </FIELDS>
      <KEYS>
        <KEY NAME="primary" TYPE="primary" FIELDS="id"/>
        <KEY NAME="docid" TYPE="unique" FIELDS="docid"/>
      </KEYS>
      <INDEXES>
        <INDEX NAME="owneruserid-contextid" UNIQUE="false" FIELDS="owneruserid, contextid" COMMENT="Query filters if no extra search filters are applied"/>
      </INDEXES>
    </TABLE>
  </TABLES>
</XMLDB>