<?xml version="1.0" encoding="UTF-8" ?>
<XMLDB PATH="mod/data/db" VERSION="20160906" COMMENT="XMLDB file for Moodle mod/data"
    xmlns:xsi="http://www.w3.org/2001/XMLSchema-instance"
    xsi:noNamespaceSchemaLocation="../../../lib/xmldb/xmldb.xsd"
>
  <TABLES>
    <TABLE NAME="data" COMMENT="all database activities">
      <FIELDS>
        <FIELD NAME="id" TYPE="int" LENGTH="10" NOTNULL="true" SEQUENCE="true"/>
        <FIELD NAME="course" TYPE="int" LENGTH="10" NOTNULL="true" DEFAULT="0" SEQUENCE="false"/>
        <FIELD NAME="name" TYPE="char" LENGTH="255" NOTNULL="true" SEQUENCE="false"/>
        <FIELD NAME="intro" TYPE="text" NOTNULL="true" SEQUENCE="false"/>
        <FIELD NAME="introformat" TYPE="int" LENGTH="4" NOTNULL="true" DEFAULT="0" SEQUENCE="false"/>
        <FIELD NAME="comments" TYPE="int" LENGTH="4" NOTNULL="true" DEFAULT="0" SEQUENCE="false"/>
        <FIELD NAME="timeavailablefrom" TYPE="int" LENGTH="10" NOTNULL="true" DEFAULT="0" SEQUENCE="false"/>
        <FIELD NAME="timeavailableto" TYPE="int" LENGTH="10" NOTNULL="true" DEFAULT="0" SEQUENCE="false"/>
        <FIELD NAME="timeviewfrom" TYPE="int" LENGTH="10" NOTNULL="true" DEFAULT="0" SEQUENCE="false"/>
        <FIELD NAME="timeviewto" TYPE="int" LENGTH="10" NOTNULL="true" DEFAULT="0" SEQUENCE="false"/>
        <FIELD NAME="requiredentries" TYPE="int" LENGTH="8" NOTNULL="true" DEFAULT="0" SEQUENCE="false"/>
        <FIELD NAME="requiredentriestoview" TYPE="int" LENGTH="8" NOTNULL="true" DEFAULT="0" SEQUENCE="false"/>
        <FIELD NAME="maxentries" TYPE="int" LENGTH="8" NOTNULL="true" DEFAULT="0" SEQUENCE="false"/>
        <FIELD NAME="rssarticles" TYPE="int" LENGTH="4" NOTNULL="true" DEFAULT="0" SEQUENCE="false"/>
        <FIELD NAME="singletemplate" TYPE="text" NOTNULL="false" SEQUENCE="false"/>
        <FIELD NAME="listtemplate" TYPE="text" NOTNULL="false" SEQUENCE="false"/>
        <FIELD NAME="listtemplateheader" TYPE="text" NOTNULL="false" SEQUENCE="false"/>
        <FIELD NAME="listtemplatefooter" TYPE="text" NOTNULL="false" SEQUENCE="false"/>
        <FIELD NAME="addtemplate" TYPE="text" NOTNULL="false" SEQUENCE="false"/>
        <FIELD NAME="rsstemplate" TYPE="text" NOTNULL="false" SEQUENCE="false"/>
        <FIELD NAME="rsstitletemplate" TYPE="text" NOTNULL="false" SEQUENCE="false"/>
        <FIELD NAME="csstemplate" TYPE="text" NOTNULL="false" SEQUENCE="false"/>
        <FIELD NAME="jstemplate" TYPE="text" NOTNULL="false" SEQUENCE="false"/>
        <FIELD NAME="asearchtemplate" TYPE="text" NOTNULL="false" SEQUENCE="false"/>
        <FIELD NAME="approval" TYPE="int" LENGTH="4" NOTNULL="true" DEFAULT="0" SEQUENCE="false"/>
        <FIELD NAME="manageapproved" TYPE="int" LENGTH="4" NOTNULL="true" DEFAULT="1" SEQUENCE="false"/>
        <FIELD NAME="scale" TYPE="int" LENGTH="10" NOTNULL="true" DEFAULT="0" SEQUENCE="false"/>
        <FIELD NAME="assessed" TYPE="int" LENGTH="10" NOTNULL="true" DEFAULT="0" SEQUENCE="false"/>
        <FIELD NAME="assesstimestart" TYPE="int" LENGTH="10" NOTNULL="true" DEFAULT="0" SEQUENCE="false"/>
        <FIELD NAME="assesstimefinish" TYPE="int" LENGTH="10" NOTNULL="true" DEFAULT="0" SEQUENCE="false"/>
        <FIELD NAME="defaultsort" TYPE="int" LENGTH="10" NOTNULL="true" DEFAULT="0" SEQUENCE="false"/>
        <FIELD NAME="defaultsortdir" TYPE="int" LENGTH="4" NOTNULL="true" DEFAULT="0" SEQUENCE="false"/>
        <FIELD NAME="editany" TYPE="int" LENGTH="4" NOTNULL="true" DEFAULT="0" SEQUENCE="false"/>
        <FIELD NAME="notification" TYPE="int" LENGTH="10" NOTNULL="true" DEFAULT="0" SEQUENCE="false" COMMENT="Notify people when things change"/>
        <FIELD NAME="timemodified" TYPE="int" LENGTH="10" NOTNULL="true" DEFAULT="0" SEQUENCE="false" COMMENT="The time the settings for this database module instance were last modified."/>
        <FIELD NAME="config" TYPE="text" NOTNULL="false" SEQUENCE="false"/>
        <FIELD NAME="completionentries" TYPE="int" LENGTH="10" NOTNULL="false" DEFAULT="0" SEQUENCE="false" COMMENT="Number of entries required for completion"/>
      </FIELDS>
      <KEYS>
        <KEY NAME="primary" TYPE="primary" FIELDS="id"/>
      </KEYS>
      <INDEXES>
        <INDEX NAME="course" UNIQUE="false" FIELDS="course"/>
      </INDEXES>
    </TABLE>
    <TABLE NAME="data_fields" COMMENT="every field available">
      <FIELDS>
        <FIELD NAME="id" TYPE="int" LENGTH="10" NOTNULL="true" SEQUENCE="true"/>
        <FIELD NAME="dataid" TYPE="int" LENGTH="10" NOTNULL="true" DEFAULT="0" SEQUENCE="false"/>
        <FIELD NAME="type" TYPE="char" LENGTH="255" NOTNULL="true" SEQUENCE="false"/>
        <FIELD NAME="name" TYPE="char" LENGTH="255" NOTNULL="true" SEQUENCE="false"/>
        <FIELD NAME="description" TYPE="text" NOTNULL="true" SEQUENCE="false"/>
        <FIELD NAME="required" TYPE="int" LENGTH="1" NOTNULL="true" DEFAULT="0" SEQUENCE="false" COMMENT="Required fields must have a value when inserted by a user"/>
        <FIELD NAME="param1" TYPE="text" NOTNULL="false" SEQUENCE="false"/>
        <FIELD NAME="param2" TYPE="text" NOTNULL="false" SEQUENCE="false"/>
        <FIELD NAME="param3" TYPE="text" NOTNULL="false" SEQUENCE="false"/>
        <FIELD NAME="param4" TYPE="text" NOTNULL="false" SEQUENCE="false"/>
        <FIELD NAME="param5" TYPE="text" NOTNULL="false" SEQUENCE="false"/>
        <FIELD NAME="param6" TYPE="text" NOTNULL="false" SEQUENCE="false"/>
        <FIELD NAME="param7" TYPE="text" NOTNULL="false" SEQUENCE="false"/>
        <FIELD NAME="param8" TYPE="text" NOTNULL="false" SEQUENCE="false"/>
        <FIELD NAME="param9" TYPE="text" NOTNULL="false" SEQUENCE="false"/>
        <FIELD NAME="param10" TYPE="text" NOTNULL="false" SEQUENCE="false"/>
      </FIELDS>
      <KEYS>
        <KEY NAME="primary" TYPE="primary" FIELDS="id"/>
        <KEY NAME="dataid" TYPE="foreign" FIELDS="dataid" REFTABLE="data" REFFIELDS="id"/>
      </KEYS>
      <INDEXES>
        <INDEX NAME="type-dataid" UNIQUE="false" FIELDS="type, dataid" COMMENT="used by data linking filter"/>
      </INDEXES>
    </TABLE>
    <TABLE NAME="data_records" COMMENT="every record introduced">
      <FIELDS>
        <FIELD NAME="id" TYPE="int" LENGTH="10" NOTNULL="true" SEQUENCE="true"/>
        <FIELD NAME="userid" TYPE="int" LENGTH="10" NOTNULL="true" DEFAULT="0" SEQUENCE="false"/>
        <FIELD NAME="groupid" TYPE="int" LENGTH="10" NOTNULL="true" DEFAULT="0" SEQUENCE="false"/>
        <FIELD NAME="dataid" TYPE="int" LENGTH="10" NOTNULL="true" DEFAULT="0" SEQUENCE="false"/>
        <FIELD NAME="timecreated" TYPE="int" LENGTH="10" NOTNULL="true" DEFAULT="0" SEQUENCE="false"/>
        <FIELD NAME="timemodified" TYPE="int" LENGTH="10" NOTNULL="true" DEFAULT="0" SEQUENCE="false"/>
        <FIELD NAME="approved" TYPE="int" LENGTH="4" NOTNULL="true" DEFAULT="0" SEQUENCE="false"/>
      </FIELDS>
      <KEYS>
        <KEY NAME="primary" TYPE="primary" FIELDS="id"/>
        <KEY NAME="dataid" TYPE="foreign" FIELDS="dataid" REFTABLE="data" REFFIELDS="id"/>
      </KEYS>
    </TABLE>
    <TABLE NAME="data_content" COMMENT="the content introduced in each record/fields">
      <FIELDS>
        <FIELD NAME="id" TYPE="int" LENGTH="10" NOTNULL="true" SEQUENCE="true"/>
        <FIELD NAME="fieldid" TYPE="int" LENGTH="10" NOTNULL="true" DEFAULT="0" SEQUENCE="false"/>
        <FIELD NAME="recordid" TYPE="int" LENGTH="10" NOTNULL="true" DEFAULT="0" SEQUENCE="false"/>
        <FIELD NAME="content" TYPE="text" NOTNULL="false" SEQUENCE="false"/>
        <FIELD NAME="content1" TYPE="text" NOTNULL="false" SEQUENCE="false"/>
        <FIELD NAME="content2" TYPE="text" NOTNULL="false" SEQUENCE="false"/>
        <FIELD NAME="content3" TYPE="text" NOTNULL="false" SEQUENCE="false"/>
        <FIELD NAME="content4" TYPE="text" NOTNULL="false" SEQUENCE="false"/>
      </FIELDS>
      <KEYS>
        <KEY NAME="primary" TYPE="primary" FIELDS="id"/>
        <KEY NAME="recordid" TYPE="foreign" FIELDS="recordid" REFTABLE="data_records" REFFIELDS="id"/>
        <KEY NAME="fieldid" TYPE="foreign" FIELDS="fieldid" REFTABLE="data_fields" REFFIELDS="id"/>
      </KEYS>
    </TABLE>
  </TABLES>
</XMLDB>