<?xml version="1.0" encoding="UTF-8" ?>
<XMLDB PATH="blocks/rss_client/db" VERSION="20150717" COMMENT="XMLDB file for Moodle rss_client block"
    xmlns:xsi="http://www.w3.org/2001/XMLSchema-instance"
    xsi:noNamespaceSchemaLocation="../../../lib/xmldb/xmldb.xsd"
>
  <TABLES>
    <TABLE NAME="block_rss_client" COMMENT="Remote news feed information. Contains the news feed id, the userid of the user who added the feed, the title of the feed itself and a description of the feed contents along with the url used to access the remote feed. Preferredtitle is a field for future use - intended to allow for custom titles rather than those found in the feed">
      <FIELDS>
        <FIELD NAME="id" TYPE="int" LENGTH="10" NOTNULL="true" SEQUENCE="true"/>
        <FIELD NAME="userid" TYPE="int" LENGTH="10" NOTNULL="true" DEFAULT="0" SEQUENCE="false"/>
        <FIELD NAME="title" TYPE="text" NOTNULL="true" SEQUENCE="false"/>
        <FIELD NAME="preferredtitle" TYPE="char" LENGTH="64" NOTNULL="true" SEQUENCE="false"/>
        <FIELD NAME="description" TYPE="text" NOTNULL="true" SEQUENCE="false"/>
        <FIELD NAME="shared" TYPE="int" LENGTH="2" NOTNULL="true" DEFAULT="0" SEQUENCE="false"/>
        <FIELD NAME="url" TYPE="char" LENGTH="255" NOTNULL="true" SEQUENCE="false"/>
        <FIELD NAME="skiptime" TYPE="int" LENGTH="10" NOTNULL="true" DEFAULT="0" SEQUENCE="false" COMMENT="How many seconds skip this feed for (increases every time it fails, resets to 0 when it succeeds)"/>
        <FIELD NAME="skipuntil" TYPE="int" LENGTH="10" NOTNULL="true" DEFAULT="0" SEQUENCE="false" COMMENT="Do not query this RSS feed again until this time"/>
      </FIELDS>
      <KEYS>
        <KEY NAME="primary" TYPE="primary" FIELDS="id" />
      </KEYS>
    </TABLE>
  </TABLES>
</XMLDB>
