<?xml version="1.0" encoding="UTF-8" ?>
<XMLDB PATH="mod/assign/submission/file/db" VERSION="20120423" COMMENT="XMLDB file for Moodle mod/assign/submission/file"
    xmlns:xsi="http://www.w3.org/2001/XMLSchema-instance"
    xsi:noNamespaceSchemaLocation="../../../../../lib/xmldb/xmldb.xsd"
>
  <TABLES>
    <TABLE NAME="assignsubmission_file" COMMENT="Info about file submissions for assignments">
      <FIELDS>
        <FIELD NAME="id" TYPE="int" LENGTH="10" NOTNULL="true" SEQUENCE="true"/>
        <FIELD NAME="assignment" TYPE="int" LENGTH="10" NOTNULL="true" DEFAULT="0" SEQUENCE="false"/>
        <FIELD NAME="submission" TYPE="int" LENGTH="10" NOTNULL="true" DEFAULT="0" SEQUENCE="false"/>
        <FIELD NAME="numfiles" TYPE="int" LENGTH="10" NOTNULL="true" DEFAULT="0" SEQUENCE="false" COMMENT="The number of files the student submitted."/>
      </FIELDS>
      <KEYS>
        <KEY NAME="primary" TYPE="primary" FIELDS="id" COMMENT="The unique id for this submission info."/>
        <KEY NAME="assignment" TYPE="foreign" FIELDS="assignment" REFTABLE="assign" REFFIELDS="id" COMMENT="The assignment instance this submission relates to"/>
        <KEY NAME="submission" TYPE="foreign" FIELDS="submission" REFTABLE="assign_submission" REFFIELDS="id" COMMENT="The submission this file submission relates to."/>
      </KEYS>
    </TABLE>
  </TABLES>
</XMLDB>
