<?xml version="1.0" encoding="UTF-8" ?>
<XMLDB PATH="mod/book/db" VERSION="20120515" COMMENT="XMLDB file for Moodle mod_book"
    xmlns:xsi="http://www.w3.org/2001/XMLSchema-instance"
    xsi:noNamespaceSchemaLocation="../../../lib/xmldb/xmldb.xsd"
>
  <TABLES>
    <TABLE NAME="book" COMMENT="Defines book">
      <FIELDS>
        <FIELD NAME="id" TYPE="int" LENGTH="10" NOTNULL="true" SEQUENCE="true"/>
        <FIELD NAME="course" TYPE="int" LENGTH="10" NOTNULL="true" DEFAULT="0" SEQUENCE="false"/>
        <FIELD NAME="name" TYPE="char" LENGTH="255" NOTNULL="true" SEQUENCE="false"/>
        <FIELD NAME="intro" TYPE="text" NOTNULL="false" SEQUENCE="false"/>
        <FIELD NAME="introformat" TYPE="int" LENGTH="4" NOTNULL="true" DEFAULT="0" SEQUENCE="false"/>
        <FIELD NAME="numbering" TYPE="int" LENGTH="4" NOTNULL="true" DEFAULT="0" SEQUENCE="false"/>
        <FIELD NAME="navstyle" TYPE="int" LENGTH="4" NOTNULL="true" DEFAULT="1" SEQUENCE="false"/>
        <FIELD NAME="customtitles" TYPE="int" LENGTH="2" NOTNULL="true" DEFAULT="0" SEQUENCE="false"/>
        <FIELD NAME="revision" TYPE="int" LENGTH="10" NOTNULL="true" DEFAULT="0" SEQUENCE="false"/>
        <FIELD NAME="timecreated" TYPE="int" LENGTH="10" NOTNULL="true" DEFAULT="0" SEQUENCE="false"/>
        <FIELD NAME="timemodified" TYPE="int" LENGTH="10" NOTNULL="true" DEFAULT="0" SEQUENCE="false"/>
      </FIELDS>
      <KEYS>
        <KEY NAME="primary" TYPE="primary" FIELDS="id"/>
      </KEYS>
    </TABLE>
    <TABLE NAME="book_chapters" COMMENT="Defines book_chapters">
      <FIELDS>
        <FIELD NAME="id" TYPE="int" LENGTH="10" NOTNULL="true" SEQUENCE="true"/>
        <FIELD NAME="bookid" TYPE="int" LENGTH="10" NOTNULL="true" DEFAULT="0" SEQUENCE="false"/>
        <FIELD NAME="pagenum" TYPE="int" LENGTH="10" NOTNULL="true" DEFAULT="0" SEQUENCE="false"/>
        <FIELD NAME="subchapter" TYPE="int" LENGTH="10" NOTNULL="true" DEFAULT="0" SEQUENCE="false"/>
        <FIELD NAME="title" TYPE="char" LENGTH="255" NOTNULL="true" SEQUENCE="false"/>
        <FIELD NAME="content" TYPE="text" NOTNULL="true" SEQUENCE="false"/>
        <FIELD NAME="contentformat" TYPE="int" LENGTH="4" NOTNULL="true" DEFAULT="0" SEQUENCE="false"/>
        <FIELD NAME="hidden" TYPE="int" LENGTH="2" NOTNULL="true" DEFAULT="0" SEQUENCE="false"/>
        <FIELD NAME="timecreated" TYPE="int" LENGTH="10" NOTNULL="true" DEFAULT="0" SEQUENCE="false"/>
        <FIELD NAME="timemodified" TYPE="int" LENGTH="10" NOTNULL="true" DEFAULT="0" SEQUENCE="false"/>
        <FIELD NAME="importsrc" TYPE="char" LENGTH="255" NOTNULL="true" SEQUENCE="false"/>
      </FIELDS>
      <KEYS>
        <KEY NAME="primary" TYPE="primary" FIELDS="id"/>
      </KEYS>
    </TABLE>
  </TABLES>
</XMLDB>
