<?xml version="1.0" encoding="UTF-8" ?>
<XMLDB PATH="mod/assign/submission/onlinetext/db" VERSION="20120423" COMMENT="XMLDB file for Moodle mod/assign/submission/onlinetext"
    xmlns:xsi="http://www.w3.org/2001/XMLSchema-instance"
    xsi:noNamespaceSchemaLocation="../../../../../lib/xmldb/xmldb.xsd"
>
  <TABLES>
    <TABLE NAME="assignsubmission_onlinetext" COMMENT="Info about onlinetext submission">
      <FIELDS>
        <FIELD NAME="id" TYPE="int" LENGTH="10" NOTNULL="true" SEQUENCE="true"/>
        <FIELD NAME="assignment" TYPE="int" LENGTH="10" NOTNULL="true" DEFAULT="0" SEQUENCE="false"/>
        <FIELD NAME="submission" TYPE="int" LENGTH="10" NOTNULL="true" DEFAULT="0" SEQUENCE="false"/>
        <FIELD NAME="onlinetext" TYPE="text" NOTNULL="false" SEQUENCE="false" COMMENT="The text for this online text submission."/>
        <FIELD NAME="onlineformat" TYPE="int" LENGTH="4" NOTNULL="true" DEFAULT="0" SEQUENCE="false" COMMENT="The format for this online text submission."/>
      </FIELDS>
      <KEYS>
        <KEY NAME="primary" TYPE="primary" FIELDS="id" COMMENT="The unique id for this onlinetext submission."/>
        <KEY NAME="assignment" TYPE="foreign" FIELDS="assignment" REFTABLE="assign" REFFIELDS="id" COMMENT="The assignment instance this online text submission relates to."/>
        <KEY NAME="submission" TYPE="foreign" FIELDS="submission" REFTABLE="assign_submission" REFFIELDS="id" COMMENT="The submission this online text submission relates to."/>
      </KEYS>
    </TABLE>
  </TABLES>
</XMLDB>
