<?xml version="1.0" encoding="UTF-8" ?>
<XMLDB PATH="mod/workshop/form/comments/db" VERSION="20120122" COMMENT="XMLDB file for Moodle Comments grading strategy"
    xmlns:xsi="http://www.w3.org/2001/XMLSchema-instance"
    xsi:noNamespaceSchemaLocation="../../../../../lib/xmldb/xmldb.xsd"
>
  <TABLES>
    <TABLE NAME="workshopform_comments" COMMENT="The assessment dimensions definitions of Comments strategy forms">
      <FIELDS>
        <FIELD NAME="id" TYPE="int" LENGTH="10" NOTNULL="true" SEQUENCE="true"/>
        <FIELD NAME="workshopid" TYPE="int" LENGTH="10" NOTNULL="true" SEQUENCE="false" COMMENT="Workshop ID"/>
        <FIELD NAME="sort" TYPE="int" LENGTH="10" NOTNULL="false" DEFAULT="0" SEQUENCE="false" COMMENT="Defines the dimension order within the assessment form"/>
        <FIELD NAME="description" TYPE="text" LENGTH="big" NOTNULL="false" SEQUENCE="false" COMMENT="The description of the dimension"/>
        <FIELD NAME="descriptionformat" TYPE="int" LENGTH="3" NOTNULL="false" DEFAULT="0" SEQUENCE="false" COMMENT="The format of the description field"/>
      </FIELDS>
      <KEYS>
        <KEY NAME="primary" TYPE="primary" FIELDS="id"/>
        <KEY NAME="workshop_fk" TYPE="foreign" FIELDS="workshopid" REFTABLE="workshop" REFFIELDS="id"/>
      </KEYS>
    </TABLE>
  </TABLES>
</XMLDB>
