<?xml version="1.0" encoding="UTF-8" ?>
<XMLDB PATH="local/email/db" VERSION="20170807" COMMENT="XMLDB file for Moodle local/email"
    xmlns:xsi="http://www.w3.org/2001/XMLSchema-instance"
    xsi:noNamespaceSchemaLocation="../../../lib/xmldb/xmldb.xsd"
>
  <TABLES>
    <TABLE NAME="email_template" COMMENT="Table for company email templates">
      <FIELDS>
        <FIELD NAME="id" TYPE="int" LENGTH="10" NOTNULL="true" SEQUENCE="true"/>
        <FIELD NAME="companyid" TYPE="int" LENGTH="10" NOTNULL="true" SEQUENCE="false"/>
        <FIELD NAME="name" TYPE="char" LENGTH="50" NOTNULL="true" SEQUENCE="false"/>
        <FIELD NAME="lang" TYPE="char" LENGTH="20" NOTNULL="true" DEFAULT="en" SEQUENCE="false"/>
        <FIELD NAME="subject" TYPE="char" LENGTH="100" NOTNULL="true" SEQUENCE="false"/>
        <FIELD NAME="body" TYPE="text" NOTNULL="true" SEQUENCE="false"/>
      </FIELDS>
      <KEYS>
        <KEY NAME="primary" TYPE="primary" FIELDS="id"/>
        <KEY NAME="companyid_fk" TYPE="foreign" FIELDS="companyid" REFTABLE="company" REFFIELDS="id"/>
      </KEYS>
    </TABLE>
    <TABLE NAME="email" COMMENT="emails to be processed, send or that have been sent">
      <FIELDS>
        <FIELD NAME="id" TYPE="int" LENGTH="10" NOTNULL="true" SEQUENCE="true"/>
        <FIELD NAME="templatename" TYPE="char" LENGTH="100" NOTNULL="false" SEQUENCE="false"/>
        <FIELD NAME="modifiedtime" TYPE="int" LENGTH="20" NOTNULL="true" SEQUENCE="false"/>
        <FIELD NAME="sent" TYPE="int" LENGTH="20" NOTNULL="false" SEQUENCE="false"/>
        <FIELD NAME="subject" TYPE="char" LENGTH="255" NOTNULL="true" SEQUENCE="false"/>
        <FIELD NAME="body" TYPE="text" NOTNULL="true" SEQUENCE="false"/>
        <FIELD NAME="varsreplaced" TYPE="int" LENGTH="20" NOTNULL="false" SEQUENCE="false"/>
        <FIELD NAME="courseid" TYPE="int" LENGTH="20" NOTNULL="false" SEQUENCE="false"/>
        <FIELD NAME="userid" TYPE="int" LENGTH="20" NOTNULL="true" SEQUENCE="false"/>
        <FIELD NAME="invoiceid" TYPE="int" LENGTH="20" NOTNULL="false" SEQUENCE="false"/>
        <FIELD NAME="classroomid" TYPE="int" LENGTH="20" NOTNULL="false" SEQUENCE="false"/>
        <FIELD NAME="senderid" TYPE="int" LENGTH="20" NOTNULL="false" SEQUENCE="false" COMMENT="User ID of the person who the email is to be sent from"/>
        <FIELD NAME="headers" TYPE="text" NOTNULL="false" SEQUENCE="false" COMMENT="field to hold serialized custom headers"/>
        <FIELD NAME="due" TYPE="int" LENGTH="20" NOTNULL="true" DEFAULT="0" SEQUENCE="false" COMMENT="This is the timestamp when the email is due to be sent."/>
      </FIELDS>
      <KEYS>
        <KEY NAME="primary" TYPE="primary" FIELDS="id"/>
      </KEYS>
    </TABLE>
  </TABLES>
</XMLDB>