<?xml version="1.0" encoding="UTF-8" ?>
<XMLDB PATH="enrol/flatfile/db" VERSION="20120122" COMMENT="XMLDB file for Moodle enrol/flatfile"
    xmlns:xsi="http://www.w3.org/2001/XMLSchema-instance"
    xsi:noNamespaceSchemaLocation="../../../lib/xmldb/xmldb.xsd"
>
  <TABLES>
    <TABLE NAME="enrol_flatfile" COMMENT="enrol_flatfile table retrofitted from MySQL">
      <FIELDS>
        <FIELD NAME="id" TYPE="int" LENGTH="10" NOTNULL="true" SEQUENCE="true"/>
        <FIELD NAME="action" TYPE="char" LENGTH="30" NOTNULL="true" SEQUENCE="false"/>
        <FIELD NAME="roleid" TYPE="int" LENGTH="10" NOTNULL="true" SEQUENCE="false"/>
        <FIELD NAME="userid" TYPE="int" LENGTH="10" NOTNULL="true" SEQUENCE="false"/>
        <FIELD NAME="courseid" TYPE="int" LENGTH="10" NOTNULL="true" SEQUENCE="false"/>
        <FIELD NAME="timestart" TYPE="int" LENGTH="10" NOTNULL="true" DEFAULT="0" SEQUENCE="false"/>
        <FIELD NAME="timeend" TYPE="int" LENGTH="10" NOTNULL="true" DEFAULT="0" SEQUENCE="false"/>
        <FIELD NAME="timemodified" TYPE="int" LENGTH="10" NOTNULL="true" DEFAULT="0" SEQUENCE="false"/>
      </FIELDS>
      <KEYS>
        <KEY NAME="id" TYPE="primary" FIELDS="id" COMMENT="primary key"/>
        <KEY NAME="courseid-id" TYPE="foreign" FIELDS="courseid" REFTABLE="course" REFFIELDS="id"/>
        <KEY NAME="userid-id" TYPE="foreign" FIELDS="userid" REFTABLE="user" REFFIELDS="id"/>
        <KEY NAME="roleid-id" TYPE="foreign" FIELDS="roleid" REFTABLE="role" REFFIELDS="id"/>
      </KEYS>
    </TABLE>
  </TABLES>
</XMLDB>