<?xml version="1.0" encoding="UTF-8" ?>
<XMLDB PATH="admin/tool/log/store/standard/db" VERSION="20140415" COMMENT="XMLDB file for Moodle admin/tool/log/store/standard"
    xmlns:xsi="http://www.w3.org/2001/XMLSchema-instance"
    xsi:noNamespaceSchemaLocation="../../../../../../lib/xmldb/xmldb.xsd"
>
  <TABLES>
    <TABLE NAME="logstore_standard_log" COMMENT="Standard log table">
      <FIELDS>
        <FIELD NAME="id" TYPE="int" LENGTH="10" NOTNULL="true" SEQUENCE="true"/>
        <FIELD NAME="eventname" TYPE="char" LENGTH="255" NOTNULL="true" SEQUENCE="false"/>
        <FIELD NAME="component" TYPE="char" LENGTH="100" NOTNULL="true" SEQUENCE="false"/>
        <FIELD NAME="action" TYPE="char" LENGTH="100" NOTNULL="true" SEQUENCE="false"/>
        <FIELD NAME="target" TYPE="char" LENGTH="100" NOTNULL="true" SEQUENCE="false"/>
        <FIELD NAME="objecttable" TYPE="char" LENGTH="50" NOTNULL="false" SEQUENCE="false"/>
        <FIELD NAME="objectid" TYPE="int" LENGTH="10" NOTNULL="false" SEQUENCE="false"/>
        <FIELD NAME="crud" TYPE="char" LENGTH="1" NOTNULL="true" SEQUENCE="false"/>
        <FIELD NAME="edulevel" TYPE="int" LENGTH="1" NOTNULL="true" SEQUENCE="false"/>
        <FIELD NAME="contextid" TYPE="int" LENGTH="10" NOTNULL="true" SEQUENCE="false"/>
        <FIELD NAME="contextlevel" TYPE="int" LENGTH="10" NOTNULL="true" SEQUENCE="false"/>
        <FIELD NAME="contextinstanceid" TYPE="int" LENGTH="10" NOTNULL="true" SEQUENCE="false"/>
        <FIELD NAME="userid" TYPE="int" LENGTH="10" NOTNULL="true" SEQUENCE="false"/>
        <FIELD NAME="courseid" TYPE="int" LENGTH="10" NOTNULL="false" SEQUENCE="false"/>
        <FIELD NAME="relateduserid" TYPE="int" LENGTH="10" NOTNULL="false" SEQUENCE="false"/>
        <FIELD NAME="anonymous" TYPE="int" LENGTH="1" NOTNULL="true" DEFAULT="0" SEQUENCE="false" COMMENT="Was this event anonymous at the time of triggering?"/>
        <FIELD NAME="other" TYPE="text" NOTNULL="false" SEQUENCE="false"/>
        <FIELD NAME="timecreated" TYPE="int" LENGTH="10" NOTNULL="true" SEQUENCE="false"/>
        <FIELD NAME="origin" TYPE="char" LENGTH="10" NOTNULL="false" SEQUENCE="false" COMMENT="cli, cron, ws, etc."/>
        <FIELD NAME="ip" TYPE="char" LENGTH="45" NOTNULL="false" SEQUENCE="false" COMMENT="IP address"/>
        <FIELD NAME="realuserid" TYPE="int" LENGTH="10" NOTNULL="false" SEQUENCE="false" COMMENT="real user id when logged-in-as"/>
      </FIELDS>
      <KEYS>
        <KEY NAME="primary" TYPE="primary" FIELDS="id"/>
        <KEY NAME="contextid" TYPE="foreign" FIELDS="contextid" REFTABLE="context" REFFIELDS="id"/>
      </KEYS>
      <INDEXES>
        <INDEX NAME="timecreated" UNIQUE="false" FIELDS="timecreated"/>
        <INDEX NAME="course-time" UNIQUE="false" FIELDS="courseid, anonymous, timecreated"/>
        <INDEX NAME="user-module" UNIQUE="false" FIELDS="userid, contextlevel, contextinstanceid, crud, edulevel, timecreated"/>
      </INDEXES>
    </TABLE>
  </TABLES>
</XMLDB>